{
  "counts": {
    "classes": 60,
    "files": 141,
    "methods": 645,
    "modules": 64,
    "surfaces": 67,
    "tests": 104
  },
  "layer": "index",
  "paths": [
    ".github/workflows/deploy-pages.yml",
    "404.html",
    "admin/build/assemble_site.py",
    "admin/build/chrome.py",
    "admin/build/gate.py",
    "admin/build/gen_chrome.py",
    "admin/build/gen_diagrams.py",
    "admin/build/gen_docs.py",
    "admin/build/gen_features.py",
    "admin/build/gen_llms.py",
    "admin/build/gen_search.py",
    "admin/build/gen_terms.py",
    "admin/build/gen_twins.py",
    "admin/build/gen_versions.py",
    "admin/build/html_to_md.py",
    "admin/build/md_to_html.py",
    "admin/build/pages.py",
    "admin/build/release.py",
    "admin/build/tag_release.py",
    "admin/build/validate.js",
    "admin/build/verify_live.py",
    "admin/comms.html",
    "admin/index.html",
    "admin/versions.html",
    "app/config/storage-keys.js",
    "assets/mockups.css",
    "assets/nav.js",
    "assets/site.css",
    "assets/theme.js",
    "assets/themes.css",
    "components/passkey-lab/passkey-lab.css",
    "components/passkey-lab/passkey-lab.html",
    "components/passkey-lab/passkey-lab.js",
    "components/proto-app/proto-app.css",
    "components/proto-app/proto-app.html",
    "components/proto-app/proto-app.js",
    "components/proto-base/proto-base.css",
    "components/proto-base/proto-base.html",
    "components/proto-base/proto-base.js",
    "components/proto-column/proto-column.css",
    "components/proto-column/proto-column.html",
    "components/proto-column/proto-column.js",
    "components/reader-chat/reader-chat.css",
    "components/reader-chat/reader-chat.html",
    "components/reader-chat/reader-chat.js",
    "components/reader-log/reader-log.css",
    "components/reader-log/reader-log.html",
    "components/reader-log/reader-log.js",
    "components/reader-panel/reader-panel.css",
    "components/reader-panel/reader-panel.html",
    "components/reader-panel/reader-panel.js",
    "components/sg-base/sg-base.css",
    "components/sg-base/sg-base.html",
    "components/sg-base/sg-base.js",
    "docs/design/brief-corrections.html",
    "docs/design/index.html",
    "docs/design/riskmandate-aws-cognito-architecture.html",
    "docs/design/riskmandate-gcp-key-vault-password-manager-mvp.html",
    "docs/design/riskmandate-user-onboarding-account-experience.html",
    "docs/design/riskmandate-workspace-architecture-briefing.html",
    "docs/design/secrets-sgit-ai__mvp-build-brief.html",
    "docs/index.html",
    "docs/ops/bootstrap.html",
    "docs/ops/branch-protection.html",
    "docs/ops/comms.html",
    "docs/ops/dns.html",
    "docs/ops/index.html",
    "docs/ops/needs.html",
    "docs/ops/release.html",
    "docs/reality.html",
    "environments/index.html",
    "how-it-works/index.html",
    "index.html",
    "infra/bootstrap/bootstrap.sh",
    "infra/rules/storage.rules",
    "keyring/index.html",
    "learn/index.html",
    "mockups/index.html",
    "reader/index.html",
    "review/index.html",
    "review/tools/brief.py",
    "review/tools/claims.py",
    "review/tools/derive.py",
    "review/tools/freshness.py",
    "review/tools/readme.py",
    "review/tools/review_tree.py",
    "review/tools/schema.py",
    "review/tools/sections.py",
    "review/tools/validate_review.py",
    "review/ui/components/review-base/review-base.css",
    "review/ui/components/review-base/review-base.html",
    "review/ui/components/review-base/review-base.js",
    "review/ui/components/review-brief/review-brief.css",
    "review/ui/components/review-brief/review-brief.html",
    "review/ui/components/review-brief/review-brief.js",
    "review/ui/components/review-code/review-code.css",
    "review/ui/components/review-code/review-code.html",
    "review/ui/components/review-code/review-code.js",
    "review/ui/components/review-crumb/review-crumb.css",
    "review/ui/components/review-crumb/review-crumb.html",
    "review/ui/components/review-crumb/review-crumb.js",
    "review/ui/components/review-graph/review-graph.css",
    "review/ui/components/review-graph/review-graph.html",
    "review/ui/components/review-graph/review-graph.js",
    "review/ui/components/review-ladder/review-ladder.css",
    "review/ui/components/review-ladder/review-ladder.html",
    "review/ui/components/review-ladder/review-ladder.js",
    "review/ui/components/review-node/review-node.css",
    "review/ui/components/review-node/review-node.html",
    "review/ui/components/review-node/review-node.js",
    "review/ui/components/review-source/review-source.css",
    "review/ui/components/review-source/review-source.html",
    "review/ui/components/review-source/review-source.js",
    "review/ui/components/review-tree/review-tree.css",
    "review/ui/components/review-tree/review-tree.html",
    "review/ui/components/review-tree/review-tree.js",
    "review/ui/index.html",
    "review/ui/shell.css",
    "review/ui/shell.js",
    "review/ui/tokens.css",
    "security/index.html",
    "sharing/index.html",
    "shipped/index.html",
    "team/index.html",
    "tests/build/test_chrome_in_every_page.py",
    "tests/build/test_claims.py",
    "tests/build/test_derive.py",
    "tests/build/test_features_schema.py",
    "tests/build/test_generators_check.py",
    "tests/build/test_html_to_md.py",
    "tests/build/test_learn.py",
    "tests/build/test_md_to_html.py",
    "tests/build/test_mockups.py",
    "tests/build/test_reader.py",
    "tests/build/test_review_folder.py",
    "tests/build/test_review_ui.py",
    "tests/build/test_themes.py",
    "tests/build/test_twins_exist.py",
    "tests/unit/validate.test.js",
    "vendor/acorn.mjs",
    "vendor/sg-tokens.css"
  ],
  "provenance": {
    "commit": "baf16bde75c4677e91b3af7436a03f4e6fb7e17f",
    "inputs": {
      ".github/workflows/deploy-pages.yml": "049991bbdd5f2392a57743549312512869a6753e213d996cd4377afc0ad5807e",
      "404.html": "3a6d41a3e0e0687504d5478efaa7f22511f74099aad55b12674fe481339842b4",
      "admin/build/assemble_site.py": "560c312956e540d3e48ff13df69cc1173df5ffbed59f0cd1a7b1a1711e7be31f",
      "admin/build/chrome.py": "750e4b4ec6ca20e4c6bdc0a6f897590d91ca180513e0a3a424187c965da3a9a3",
      "admin/build/gate.py": "53bf2841ab13488839b1f999bdcd1232a549973cedb53570333f4cb7e3988841",
      "admin/build/gen_chrome.py": "702aec56f2c9d2e87b138e944e07d6c66f60b459519c545e913ef75bfa9189fe",
      "admin/build/gen_diagrams.py": "69537df6149d2acd562ee0b2e4860d4ae8e6ca9bfe5d49cf22f059b0e2b87d8b",
      "admin/build/gen_docs.py": "698761ae15847e90ccbb88367274f78b408fa1ce549b30d9c995b494a1126984",
      "admin/build/gen_features.py": "63bc6861ed19d7b228822d7b1dd7f9225a1c7f113c5b68fcc0839f73649312f0",
      "admin/build/gen_llms.py": "9964a8d3d69c884b142ec26e5de2d4fad1dab137ae98609159cd30e7f416d930",
      "admin/build/gen_search.py": "c95b637874318ad5a0839625693482f95195299b393261dceb04564408cbf050",
      "admin/build/gen_terms.py": "ab0f2a822249d4770c876b3a458384833a77ef78fcc9e7955e62e909c1658e8c",
      "admin/build/gen_twins.py": "970b3654f1e836ffd9a55f7446e8a001bb5f9e8502859041e135eff34067b450",
      "admin/build/gen_versions.py": "5636c992e1203d293e429799c8137badd74425e8bbdfd7e0cefc39cc4c33a311",
      "admin/build/html_to_md.py": "d35242d42aa6151783743665500eeedb0d6eb04891626d9dbfd49b9a1f30fa1e",
      "admin/build/md_to_html.py": "97841987ebdf3aec4b7cf19fc9b0ee8a66139f34a6753e361ba139dd969e1a33",
      "admin/build/pages.py": "cf7005fd5ace37c3ead23a6c8d00b5bc3bc9718a16a686e5c70a36bbca1a9591",
      "admin/build/release.py": "9ceae016e3c901ada9ce4cd8572df4b84754dee44a40a86f5d1efb48e6d79a88",
      "admin/build/tag_release.py": "158ce432c0222b9d430c01c87a3f83e63d38a7f24f435d859190bf2bc6512cb8",
      "admin/build/validate.js": "68435b5a429a25a44843f9351cbc93cbb307ef629c67b08f952f9c92d248b12e",
      "admin/build/verify_live.py": "6077890fe9995fb22f9d1cf94c8b3a28a30f840fb1309fd95ea937d53d85b6a8",
      "admin/comms.html": "a414335e8765e122810b6f6b0e185c9886a58203f8a89432e8f809e2d23ed4e4",
      "admin/index.html": "27e38ea9d548d2fb64c55e2243ec78575189d9a2eef311ce959f175736b54244",
      "admin/versions.html": "55c44535fc3d3d5885946aefb89270648a4be86de1e63fd0a9c1d810c542a05a",
      "app/config/storage-keys.js": "3de53feb17ffd10028d330a6ae9ee660f984f8f8eb5845231948db4d1b59d666",
      "assets/mockups.css": "878d38eb32e9374482d3adbe376f4beef6cb221b4c1eff30f3a184f390e8078a",
      "assets/nav.js": "33e66df93332e4f1a45b14512657b0534a9d202f5538ecfcf2dc86e56ac20f6b",
      "assets/site.css": "b167bc58ee8067675d45672cb0ca3c1a6944cbd074ea26f991d676d28c22a0fb",
      "assets/theme.js": "ef43359d66faf716e0f02d066de0333f7c0c65f6cc918d5f5a4a012767cfa640",
      "assets/themes.css": "bd626138ed6e4b759b93ac5bc1951e071989570fcc3e21201f38a9fed608e18b",
      "components/passkey-lab/passkey-lab.css": "74c950d7d4e12f4c4a47356c6c1ba5b30340641ab378ae2fdca4762e8630769a",
      "components/passkey-lab/passkey-lab.html": "22bf3b12220a54642ff16d02ebc338a236de427b40cb1149eddc504b16dfcf51",
      "components/passkey-lab/passkey-lab.js": "87acf7111e34206209938100ffae1abfc6cb8895d40912d768035d9d23974c85",
      "components/proto-app/proto-app.css": "aceebf6bc7fc4b2901397bbdbf4721879f26afb0ae0e0c9ffb27e36b235583f6",
      "components/proto-app/proto-app.html": "054ada9d830fb37b7c02b33d187382f7686bc7122de7c4f86318d8778249c11a",
      "components/proto-app/proto-app.js": "c6d2e3fb31872bd11f06ca52edee74f14318e0a6625b30b21d293a7665e71e60",
      "components/proto-base/proto-base.css": "34ce374bce5103460fb2e6bef97e622de5d06671f518ab25ad0bbc7fe75da03e",
      "components/proto-base/proto-base.html": "23e7a5e9f5742249ccb7ee4ea4e77d4c78b6f5a581a94ee09b22afb39684e2de",
      "components/proto-base/proto-base.js": "f003b63dba9be1648a1b09fae1557fe99303c0f6b2f77a765aac3951e1e0d0f6",
      "components/proto-column/proto-column.css": "68119e7d6cc50205084fa6149eb3cb042427390d43d76a4163b81986aa4ae7ec",